{
  "schemaVersion": 1,
  "sourceId": "youtube:OQMPhkmeru0",
  "platform": "youtube",
  "platformId": "OQMPhkmeru0",
  "channel": {
    "id": "UCUyeluBRhGPCW4rPe_UvBZQ",
    "name": "The PrimeTime",
    "category": "creator-official"
  },
  "title": "The World's Evilest Company",
  "description": "Having trouble finding the right developer for your team? Get a 7-day free trial + $1,500 off with The Prime’s discount:  https://trm.sh/g2i\n\nSources:\n- https://www.forbes.com/sites/tylerroush/2026/07/01/palantir-billionaire-alex-karp-calls-ai-industry-effing-insane-in-heated-interview/\n- https://x.com/PalantirTech/status/2072114267776491695 \n- https://x.com/DavidSacks/status/2072673187666813226 \n- https://www.theinformation.com/articles/anthropic-blindsides-business-partners \n\n\nhttps://twitch.tv/ThePrimeagen - I Stream on Twitch\n\nGreat News?  Want me to research and create video????: https://www.reddit.com/r/ThePrimeagen\n\n#theprimeagen #programming #computerscience #ai #chatgippty #terminaldotshop",
  "canonicalUrl": "https://www.youtube.com/watch?v=OQMPhkmeru0",
  "publishedAt": "2026-07-03T21:50:47.000Z",
  "durationMs": 874000,
  "availability": "available",
  "lastCheckedAt": "2026-08-30T23:15:32.008Z",
  "mediaFingerprint": null,
  "provenance": {
    "allowListId": "youtube:theprimetimeagen-official",
    "discoveredAt": "2026-08-30T23:15:32.008Z",
    "runId": "2026-08-30T23-07-37-056Z-d02fc850"
  }
}
