{
  "schemaVersion": 1,
  "sourceId": "youtube:Bbt8cEyzsTk",
  "platform": "youtube",
  "platformId": "Bbt8cEyzsTk",
  "channel": {
    "id": "UCUyeluBRhGPCW4rPe_UvBZQ",
    "name": "The PrimeTime",
    "category": "creator-official"
  },
  "title": "I was right again",
  "description": "PlanetScale is the fastest and most reliable way to run Postgres and MySQL in the cloud. Combined with sharding, branching, and Query Insights, you'll spend less time fighting your database and more time shipping. Try it at https://trm.sh/planetscale\n\nSources:\n\nhttps://www.seangoedecke.com/text-tokens-as-image-tokens/ \n\nhttps://george.mand.is/2025/06/openai-charges-by-the-minute-so-make-the-minutes-shorter/ \n\n https://medium.com/@itfidele/5-common-rust-errors-and-how-to-fix-them-9bf10723d7e6 \n\nTopics Covered:\n - Images are 10x more efficient than text\n - pxpipe\n - Deepseek\n\n\nhttps://twitch.tv/ThePrimeagen - I Stream on Twitch\n\nhttps://twitter.com/terminaldotshop - Want to order coffee over SSH?\nssh terminal.shop\n\nGreat News?  Want me to research and create video????: https://www.reddit.com/r/ThePrimeagen\n\n#theprimeagen #programming #computerscience #ai #chatgippty #terminaldotshop",
  "canonicalUrl": "https://www.youtube.com/watch?v=Bbt8cEyzsTk",
  "publishedAt": "2026-07-13T13:23:08.000Z",
  "durationMs": 784000,
  "availability": "available",
  "lastCheckedAt": "2026-08-30T22:56:07.255Z",
  "mediaFingerprint": null,
  "provenance": {
    "allowListId": "youtube:theprimetimeagen-official",
    "discoveredAt": "2026-08-30T22:56:07.255Z",
    "runId": "2026-08-30T22-45-04-059Z-3159b82f"
  }
}
