{
  "schemaVersion": 1,
  "sourceId": "youtube:NuktXEikxU8",
  "platform": "youtube",
  "platformId": "NuktXEikxU8",
  "channel": {
    "id": "UCUyeluBRhGPCW4rPe_UvBZQ",
    "name": "The PrimeTime",
    "category": "creator-official"
  },
  "title": "AI Psychosis or Genius",
  "description": "PlanetScale is the fastest and most reliable way to run Postgres and MySQL in the cloud. Combined with sharding, branching, and Query Insights, you'll spend less time fighting your database and more time shipping. Try it at https://trm.sh/planetscale\n\nSources:\n\n- https://yegge.ai/essays/the-shape-of-things-to-come/\n- https://yegge.ai/essays/model-welfare/\n\nhttps://twitch.tv/ThePrimeagen - I Stream on Twitch\n\nGreat News?  Want me to research and create video????: https://www.reddit.com/r/ThePrimeagen\n\n#theprimeagen #programming #computerscience #ai #chatgippty #terminaldotshop",
  "canonicalUrl": "https://www.youtube.com/watch?v=NuktXEikxU8",
  "publishedAt": "2026-08-31T12:41:56.000Z",
  "durationMs": 1431000,
  "availability": "available",
  "lastCheckedAt": "2026-08-31T17:06:26.176Z",
  "mediaFingerprint": null,
  "provenance": {
    "allowListId": "youtube:theprimetimeagen-official",
    "discoveredAt": "2026-08-31T17:06:26.176Z",
    "runId": "2026-08-31T17-06-05-296Z-3eb84117"
  }
}
